{
  "id": "E-PPK-APOS-003",
  "intent_id": "I-PPK-APOS-001",
  "run_id": "AR-PPK-APOS-001",
  "contract_id": "C-PPK-SEC-001",
  "passed": true,
  "observed": "Final repository check passed across 104 files and four migrations; all 12 existing APOS runtime tests passed from the package root.",
  "artifact_digest": "41a50f7156652a4a4cb328744f4d49464161d23fe8d4617baa5623e7f133b2d7",
  "verifier": "scripts/check-repository.mjs and packages/apos/tests",
  "created_at": "2026-09-06T01:13:58-03:00"
}
